Area,Place to Visit,Activity Type,Description
Maskeliya,Cultural Centers,Indoor,Explore local cultural centers or museums to learn about the heritage and traditions of the region.
Mannar,Mannar Fort,Outdoor,"A colonial-era fort built by the Portuguese and later modified by the Dutch, offering historical insights and scenic views."
Mannar,Adam's Bridge (Rama's Bridge),Outdoor,A chain of limestone shoals connecting Mannar to India's Pamban Island. Significant for its geological and mythological importance.
Mannar,Baobab Tree,Outdoor,"An ancient tree believed to be over 700 years old, reflecting Mannar's diverse botanical heritage."
Mannar,Keeri Beach,Outdoor,"A serene beach perfect for swimming and relaxation, fringed by a small palmyra palm forest."
Mannar,Mannar Bird Sanctuary,Outdoor,"A haven for bird watchers, especially during the migratory season. Home to a variety of bird species."
Mannar,Giant's Tank,Outdoor,An ancient irrigation reservoir supporting agriculture and attracting various bird species. Offers scenic beauty and a glimpse into traditional farming practices.
Mannar,Shrine of Our Lady of Madhu,Indoor,A significant Catholic pilgrimage site offering a peaceful environment for reflection.
Mannar,Thiruketheeswaram Kovil,Indoor,"One of the oldest Hindu temples in Sri Lanka, dedicated to Lord Shiva. Known for its architecture and spiritual significance."
Mirissa,Whale Watching Tours,Outdoor,"Premier destination for observing blue whales, sperm whales, and dolphins. Best time is December to March during the dry season."
Mirissa,Mirissa Beach,Outdoor,"A crescent-shaped beach ideal for swimming, sunbathing, and surfing, with vibrant beach bars and restaurants."
Mirissa,Coconut Tree Hill,Outdoor,"A picturesque spot with coconut trees providing panoramic views, perfect for photography during sunrise or sunset."
Mirissa,Parrot Rock,Outdoor,"Accessible during low tide, this rock formation offers scenic views of Mirissa Beach and its surroundings."
Mirissa,Surfing at Weligama Bay,Outdoor,"A nearby bay suitable for beginners and experienced surfers, with surf schools and board rentals available."
Mirissa,Snorkeling and Diving,Outdoor,Coral reefs near Mirissa provide opportunities to observe diverse marine life with guided tours and equipment.
Mirissa,Spa and Wellness Centers,Indoor,"Ayurvedic treatments, massages, and yoga sessions offered at various wellness centers in Mirissa."
Mirissa,Cooking Classes,Indoor,"Learn to prepare Sri Lankan dishes, often with market visits to source fresh ingredients."
Mirissa,Handicraft Shops and Art Galleries,Indoor,"Explore traditional Sri Lankan arts, crafts, and souvenirs in local galleries and shops."
Pottuvil,Surfing at Arugam Bay,Outdoor,"A world-renowned surfing destination suitable for surfers of all levels, located just 2 kilometers south of Pottuvil."
Pottuvil,Kumana National Park Safari,Outdoor,"A haven for wildlife and bird enthusiasts, featuring elephants, leopards, and diverse bird species."
Pottuvil,Pottuvil Lagoon Tour,Outdoor,"Serene boat tours exploring mangroves, bird species, and occasional crocodiles or elephants in their natural habitat."
Pottuvil,Whiskey Point,Outdoor,"A tranquil beach north of Pottuvil, popular for surfing and relaxation."
Pottuvil,Peanut Farm Beach,Outdoor,"A secluded beach south of Arugam Bay, known for its surf spots and peaceful atmosphere."
Pottuvil,Muhudu Maha Vihara,Outdoor,"An ancient Buddhist temple near the beach, over 2000 years old, rich in historical and cultural significance."
Pottuvil,Cooking Classes,Indoor,Learn to prepare traditional Sri Lankan dishes using authentic techniques and fresh ingredients.
Pottuvil,Yoga and Wellness Retreats,Indoor,Participate in yoga sessions and wellness programs for relaxation and rejuvenation.
Pottuvil,Local Handicraft Shops,Indoor,"Explore shops showcasing traditional Sri Lankan arts and crafts, offering unique souvenirs."
Pottuvil,Surfing at Arugam Bay,Outdoor,"World-famous surfing destination located just south of Pottuvil, suitable for all skill levels."
Pottuvil,Kumana National Park Safari,Outdoor,Wildlife sanctuary ideal for bird watching and observing elephants and leopards in their natural habitat.
Pottuvil,Pottuvil Lagoon Tour,Outdoor,"Explore the lagoon by boat, observing mangroves, bird species, and occasional crocodiles and elephants."
Pottuvil,Whiskey Point,Outdoor,"A serene beach north of Pottuvil, popular for surfing and relaxation."
Pottuvil,Peanut Farm Beach,Outdoor,"A secluded beach south of Arugam Bay, known for its surf spots and tranquil atmosphere."
Pottuvil,Muhudu Maha Vihara,Outdoor,"An ancient Buddhist temple believed to be over 2000 years old, showcasing historical and cultural significance."
Pottuvil,Cooking Classes,Indoor,Learn to prepare Sri Lankan dishes using traditional methods and fresh ingredients.
Pottuvil,Yoga and Wellness Retreats,Indoor,Relaxing yoga sessions and wellness programs offered in serene surroundings.
Pottuvil,Local Handicraft Shops,Indoor,"Explore shops showcasing traditional Sri Lankan arts and crafts, perfect for souvenirs and cultural insights."
Mullaitivu,Mullaitivu Beach,Outdoor,"A serene and less crowded beach, ideal for relaxation and leisurely walks with pristine sands and calm waters."
Mullaitivu,Nay Aru Lagoon,Outdoor,A picturesque lagoon offering bird watching and local fishing activities amidst mangroves and wetlands.
Mullaitivu,Exploring Coastal Villages,Outdoor,Visit nearby fishing villages to gain insights into traditional livelihoods and local cultures.
Mullaitivu,Puthukkudiyiruppu War Museum,Indoor,A museum exhibiting artifacts and providing historical context about the Sri Lankan civil war.
Mullaitivu,Local Cuisine Exploration,Indoor,Experience traditional Tamil dishes and learn about the region's culinary heritage by dining at local eateries.
Dambulla,Dambulla Cave Temple,Outdoor,A UNESCO World Heritage site featuring caves adorned with Buddhist murals and statues.
Dambulla,Minneriya National Park Safari,Outdoor,"Famous for large elephant gatherings and rich wildlife, accessible via jeep safaris."
Dambulla,Pidurangala Rock,Outdoor,A moderately challenging hike leading to panoramic views of Sigiriya and the surrounding landscape.
Dambulla,Popham's Arboretum,Outdoor,"The only dry-zone arboretum in Sri Lanka, ideal for nature walks and bird watching."
Dambulla,Ibbankatuwa Megalithic Tombs,Outdoor,"An ancient burial site dating back to 700–400 BC, showcasing prehistoric culture."
Dambulla,Rose Quartz Mountain Range,Outdoor,Home to South Asia's largest rose quartz mountain range and a national ironwood forest.
Dambulla,Buddhist Museum and Museum of Wall Paintings,Indoor,Showcases a vast collection of Buddhist artifacts and intricate wall paintings.
Dambulla,Dambulla Dedicated Economic Centre,Indoor,A bustling wholesale market offering fresh produce and local trade experiences.
Dambulla,Cooking Classes,Indoor,Learn to prepare traditional Sri Lankan dishes with local chefs.
Dambulla,Dambulla Cave Temple (Golden Temple of Dambulla),Outdoor,"A UNESCO World Heritage site with caves adorned with intricate Buddhist murals and statues, showcasing ancient art and religious practices."
Dambulla,Minneriya National Park Safari,Outdoor,Famous for large elephant gatherings and diverse wildlife. Jeep safaris offer close encounters with nature.
Dambulla,Pidurangala Rock,Outdoor,"A moderately challenging hike leading to panoramic views, including a clear view of Sigiriya Rock."
Dambulla,Popham's Arboretum,Outdoor,"A 30-acre dry-zone arboretum, perfect for nature walks and bird watching."
Dambulla,Ibbankatuwa Megalithic Tombs,Outdoor,"An ancient burial site dating back to 700–400 BC, providing insights into the island's prehistoric period."
Dambulla,Rose Quartz Mountain Range (Jathika Namal Uyana),Outdoor,Features the largest rose quartz mountain range in South Asia and a national ironwood forest.
Dambulla,Buddhist Museum and Museum of Wall Paintings,Indoor,"Showcases Buddhist artifacts and intricate wall paintings, reflecting the region's rich artistic heritage."
Dambulla,Dambulla Dedicated Economic Centre,Indoor,A bustling wholesale market offering fresh produce and insights into local trade practices.
Dambulla,Cooking Classes,Indoor,Learn to prepare traditional Sri Lankan dishes using local methods and fresh ingredients.
Avissawella,Seethawaka Wet Zone Botanic Gardens,Outdoor,"A lush garden ideal for leisurely walks, picnics, and nature photography, featuring diverse flora and well-maintained paths."
Avissawella,Kumari Ella Falls,Outdoor,"A picturesque waterfall with a natural pool, offering a tranquil environment for relaxation."
Avissawella,Ella Uda Ella Falls,Outdoor,"A serene waterfall surrounded by lush greenery, perfect for nature lovers and photographers."
Avissawella,White Water Rafting in Kithulgala,Outdoor,"An exhilarating rafting experience on the Kelani River, suitable for beginners and experienced rafters."
Avissawella,Mlesna Tea Castle,Indoor,"Offers insights into Sri Lanka's tea heritage with tea tasting, product purchases, and learning about tea manufacturing."
Avissawella,Leisure World Water Park,Indoor,"An amusement park featuring water slides, pools, and various rides, ideal for family fun."
Kalutara,Kalutara Beach,Outdoor,"A serene beach ideal for relaxation, sunbathing, and picturesque beach walks."
Kalutara,Calido Beach,Outdoor,"Located near the Kalutara estuary, this beach offers a peaceful ambiance for family outings and breathtaking sunsets."
Kalutara,Richmond Castle,Outdoor,"A grand early 20th-century mansion blending Eastern and Western architectural styles, set on a 25-acre estate."
Kalutara,Fa Hien Caves,Outdoor,"One of the largest natural rock formations in Sri Lanka, of archaeological significance with evidence of prehistoric settlements."
Kalutara,Thudugala Ella Waterfall,Outdoor,"A scenic waterfall in a tranquil environment, perfect for nature lovers and picnics."
Kalutara,Kalutara Bodhiya,Indoor,A revered Buddhist temple featuring a hollow stupa with intricate murals depicting the Buddha's life.
Kalutara,Asokaramaya Buddhist Temple,Indoor,"Known for its serene atmosphere and beautiful architecture, offering insights into local religious practices."
Kalutara,Local Handicraft Shops,Indoor,"Explore traditional Sri Lankan crafts, including basket weaving and lace-making. Perfect for purchasing souvenirs."
Kalutara,Cooking Classes,Indoor,Learn to prepare traditional Sri Lankan dishes using local ingredients and techniques.
Deniyaya,Sinharaja Forest Reserve,Outdoor,A UNESCO World Heritage tropical rainforest known for its biodiversity. Guided treks offer insights into endemic flora and fauna.
Deniyaya,Olu Dola,Outdoor,"A natural pool in the Hulandawa area, accessible via a vine bridge. Ideal for serene bathing and relaxation."
Deniyaya,Tea Plantations,Outdoor,Tour lush tea estates to learn about tea cultivation and enjoy scenic views of rolling hills.
Deniyaya,Waterfall Visits,Outdoor,"Explore picturesque waterfalls near the Lankagama Entrance of the Sinharaja Forest, perfect for photography and nature walks."
Deniyaya,Dalu Tea Centre,Indoor,"Learn about tea processing, enjoy tasting sessions, and purchase freshly processed tea."
Deniyaya,Local Cultural Experiences,Indoor,Engage in traditional crafts or cooking methods with the local community to understand their cultural heritage.
Monaragala,Biso Pokuna (Queen's Pond),Outdoor,"An ancient royal bathing pool from the 12th century, showcasing the architectural ingenuity of ancient Sri Lanka."
Monaragala,Gal Oya National Park,Outdoor,Known for its boat safaris and the opportunity to see elephants swimming between islands in the Senanayake Samudraya reservoir.
Monaragala,Yala National Park,Outdoor,"Renowned for its leopard population and diverse ecosystems, offering jeep safaris through forests, grasslands, and wetlands."
Monaragala,Maduru Oya National Park,Outdoor,"A haven for wildlife enthusiasts and birdwatchers, featuring diverse flora and fauna."
Monaragala,Buduruwagala,Outdoor,"Home to seven ancient Buddhist statues carved into a rock face, surrounded by a serene forest environment."
Monaragala,Maligawila Buddha Statue,Outdoor,"One of the tallest free-standing Buddha statues in Sri Lanka, carved out of limestone and dating back to the 7th century."
Monaragala,Local Handicraft Workshops,Indoor,"Engage in traditional crafts such as pottery, weaving, and wood carving, learning from local artisans."
Monaragala,Cooking Classes,Indoor,Learn to prepare traditional Sri Lankan dishes using local ingredients in hands-on cooking sessions.
Tissamaharama,Yala National Park,Outdoor,"Renowned for its diverse wildlife, including leopards and elephants. Offers jeep safaris through varied ecosystems."
Tissamaharama,Tissa Wewa (Tissa Lake),Outdoor,"A man-made reservoir dating back to the 3rd century BC, ideal for boat rides, bird watching, and serene sunsets."
Tissamaharama,Bundala National Park,Outdoor,"A UNESCO Biosphere Reserve, famous for its flamingos and migratory bird populations, perfect for birdwatchers."
Tissamaharama,Sithulpawwa Rock Temple,Outdoor,"An ancient Buddhist monastery atop a rock, offering panoramic views and featuring historic cave paintings."
Tissamaharama,Kataragama Temple,Outdoor,"A multi-religious temple complex sacred to Buddhists, Hindus, and Muslims, vibrant during the Esala Perahera festival."
Tissamaharama,Tissamaharama Raja Maha Vihara,Indoor,"One of the largest stupas in Sri Lanka, offering insights into the region's religious heritage and historical significance."
Tissamaharama,Yatala Wehera,Indoor,"An ancient stupa surrounded by a moat, featuring intricate carvings and a museum displaying archaeological findings."
Tissamaharama,Local Handicraft Workshops,Indoor,"Engage in traditional crafts such as pottery, weaving, and wood carving, learning from local artisans."
Tissamaharama,Cooking Classes,Indoor,Learn to prepare traditional Sri Lankan dishes using local ingredients in hands-on cooking sessions.
Sella Kataragama,Sella Kataragama Temple Complex,Outdoor,"A sacred site with multiple shrines dedicated to Hindu and Buddhist deities, offering tranquil surroundings and religious rituals."
Sella Kataragama,Menik Ganga (River) Pilgrimage,Outdoor,"Visitors bathe in the Menik Ganga before proceeding to temples, enjoying a peaceful environment for reflection and relaxation."
Sella Kataragama,Nature Walks and Bird Watching,Outdoor,"Explore the lush greenery and observe local bird species, especially during early mornings and late afternoons."
Sella Kataragama,Participate in Religious Ceremonies,Indoor,Engage in daily poojas at the various shrines to gain insights into local religious practices.
Sella Kataragama,Meditation and Yoga Sessions,Indoor,Join meditation and yoga sessions at local retreat centers to promote inner peace and well-being.
Colombo,Galle Face Green,Outdoor,"An ocean-side urban park ideal for evening strolls, kite flying, and sampling local street food."
Colombo,Viharamahadevi Park,Outdoor,"The oldest and largest park in Colombo, featuring gardens, a children's play area, and a prominent Buddha statue."
Colombo,Beira Lake,Outdoor,A scenic spot in central Colombo offering boat rides and views of the city's skyline.
Colombo,Mount Lavinia Beach,Outdoor,"A popular beach with golden sands, known for sunbathing, swimming, and seafood restaurants."
Colombo,Pettah Market,Outdoor,"A bustling open-air market offering souvenirs, local goods, and vibrant street life."
Colombo,National Museum of Colombo,Indoor,Sri Lanka's largest museum showcasing artifacts like the Kandyan monarchs' throne and crown.
Colombo,Gangaramaya Temple,Indoor,A significant Buddhist temple featuring diverse architectural styles and a museum of Buddhist artifacts.
Colombo,Dutch Hospital Shopping Precinct,Indoor,A historic colonial building turned into a shopping and dining complex with boutiques and cafes.
Colombo,Colombo Lotus Tower,Indoor,"The tallest structure in South Asia, offering observation decks, restaurants, and entertainment."
Colombo,Arcade Independence Square,Indoor,"A renovated colonial building housing boutiques, eateries, and a cinema, ideal for leisure and shopping."
Gampaha,Henarathgoda Botanical Garden,Outdoor,"Renowned for being the site of the first rubber tree planting in Sri Lanka, featuring diverse flora and themed sections."
Gampaha,Maligatenna Rajamaha Viharaya,Outdoor,"An ancient Buddhist temple with serene surroundings, offering panoramic views and historical significance."
Gampaha,Negombo Lagoon,Outdoor,"Ideal for bird watching and boating, surrounded by mangrove swamps that attract various water birds."
Gampaha,Sri Gnanodaya Central College Planetarium,Indoor,"A planetarium offering educational shows about astronomy, suitable for all weather conditions."
Gampaha,Local Handicraft Workshops,Indoor,"Interactive workshops showcasing traditional Sri Lankan crafts like mask carving, pottery, and weaving."
Gampaha,Kelaniya Raja Maha Vihara,Outdoor,"A historic temple believed to have been visited by Lord Buddha, with intricate artworks and serene surroundings."
Gampaha,Muthurajawela Marsh,Outdoor,A wetland ecosystem offering boat tours to observe diverse flora and fauna in their natural habitat.
Gampaha,Seema Malaka Temple,Outdoor,"A unique temple in Colombo with tranquil architecture designed by Geoffrey Bawa, perfect for a peaceful retreat."
Dodanduwa,Dodanduwa Beach,Outdoor,"A serene beach ideal for relaxation, sunbathing, and swimming, offering a peaceful retreat with golden sands and gentle waves."
Dodanduwa,Dodanduwa Lagoon,Outdoor,"Explore the calm waters of the lagoon by boat, observing mangrove forests and local wildlife, perfect for bird watching."
Dodanduwa,Dodanduwa Fisheries Harbour,Outdoor,Visit this traditional fishing harbor to observe local fishermen's routines and traditional Oruwa boats with distinctive square sails.
Dodanduwa,Snorkeling and Diving,Outdoor,"The nearby coral reefs provide vibrant marine life for snorkeling and diving, with guided tours suitable for various experience levels."
Dodanduwa,Island Hermitage,Indoor,"A Buddhist forest monastery founded in 1911, located on Polgasduwa Island, offering insights into monastic life and meditation practices."
Dodanduwa,Shailabimbarama Maha Viharaya,Indoor,A historic Buddhist temple providing insights into local religious practices and architecture in a peaceful environment.
Horton Plains,World's End,Outdoor,"Embark on a trek to World's End, a dramatic cliff with an 870-meter drop, offering panoramic views of the surrounding landscape. The trail is approximately 9 kilometers and takes about 3 hours to complete."
Horton Plains,Baker's Falls,Outdoor,"Explore Baker's Falls, a picturesque waterfall named after British explorer Sir Samuel Baker. The falls are 20 meters high and surrounded by lush greenery."
Horton Plains,Wildlife Observation,Outdoor,"Horton Plains is rich in biodiversity, home to species like the Sri Lankan sambar deer and various endemic birds. Early morning visits increase the chances of wildlife sightings."
Horton Plains,Thotupola Kanda,Outdoor,"The Thotupola Kanda trail leads to Sri Lanka's third-highest peak, offering stunning views and diverse plant species. A moderate hike for enthusiasts."
Horton Plains,Ceylon Tea Museum in Kandy,Indoor,"Learn about Sri Lanka's tea heritage at this museum, showcasing historical tea-processing equipment and industry insights."
Horton Plains,Victoria Park in Nuwara Eliya,Indoor,"A well-maintained park ideal for leisurely walks and birdwatching, featuring a variety of flora and a small museum."
Horton Plains,Moon Plains,Outdoor,"Located approximately 15 kilometers from Horton Plains, Moon Plains offers 360-degree views of surrounding mountain ranges and is a biodiversity hotspot."
Horton Plains,Lover's Leap Waterfall,Outdoor,"A scenic waterfall near Nuwara Eliya, accessible via a short hike through tea plantations."
Horton Plains,Hakgala Botanical Garden,Outdoor,This garden is home to diverse plant species and offers a serene environment for visitors.
Sinharaja,Trekking and Hiking,Outdoor,"Explore the dense rainforest through well-marked trails, offering opportunities to observe diverse flora and fauna. Guided treks provide insights into the ecosystem's complexity."
Sinharaja,Bird Watching,Outdoor,"Sinharaja is a haven for bird enthusiasts, home to numerous endemic species like the Sri Lanka Blue Magpie and Red-faced Malkoha. Early morning excursions increase the likelihood of sightings."
Sinharaja,Waterfall Exploration,Outdoor,Discover stunning waterfalls such as Duvili Ella and Brahmana Ella within the forest. These natural cascades provide serene spots for relaxation amidst nature.
Sinharaja,Wildlife Spotting,Outdoor,"Encounter various wildlife, including the endemic purple-faced langur, leopards, and a variety of reptiles and amphibians. Guided tours enhance the chances of sightings."
Sinharaja,Jeep Safari,Outdoor,"Experience the rural lifestyle, tea gardens, and lush vegetation surrounding Sinharaja through a jeep ride, offering a different perspective of the area's natural beauty."
Sinharaja,Tea Factory Visits,Indoor,Explore nearby tea factories such as Kalubovitiyana and Mahakanda to learn about tea processing and Sri Lanka's tea culture. These visits provide insights into the traditional methods of tea production.
Sinharaja,Cinnamon Estates and Spice Gardens,Indoor,"Visit local cinnamon estates to witness the cultivation and processing of cinnamon, along with other spice gardens showcasing Sri Lanka's rich spice heritage."
Chilaw,Silver Beach,Outdoor,"Known for its captivating sunset views and gleaming fine sands. Ideal for relaxing strolls along the water's edge, with leaning coconut groves."
Chilaw,Anawilundawa Wetland Sanctuary,Outdoor,"A haven for bird watchers, home to numerous resident and endemic bird species. Provides a serene environment for nature walks and wildlife observation."
Chilaw,Chilaw Beach Park,Outdoor,"Featuring lush tropics, colorful birds, and panoramic walkways, Chilaw Beach Park is ideal for leisurely walks and picnics by the sea."
Chilaw,Fishing Village Visits,Outdoor,Experience the local fishing culture by visiting nearby fishing villages. Learn about traditional fishing methods practiced for generations.
Chilaw,Munneswaram Temple,Indoor,"An ancient Hindu temple dedicated to Lord Shiva, located about 7 km from Chilaw. Holds rich historical and religious significance."
Chilaw,Our Lady of Mount Carmel Cathedral,Indoor,"A historical cathedral dating back to 1851, serving as the seat of the Chilaw Diocese. Admire its architecture and learn about its storied past."
Matale,Riverston Peak,Outdoor,"Part of the Knuckles Mountain Range, Riverston Peak is known for its picturesque landscapes and cool climate. Offers hiking opportunities with panoramic views of the surrounding hills and valleys."
Matale,Sera Ella Waterfall,Outdoor,A beautiful waterfall accessible via a short trek through lush greenery. Visitors can enjoy the serene environment and explore a cave behind the waterfall.
Matale,Bambarakiri Ella Waterfall,Outdoor,"Situated near Rattota town, this waterfall comprises two cascades and is surrounded by a tranquil environment, ideal for relaxation and nature walks."
Matale,Spice Gardens,Outdoor,"Renowned for its spice gardens, where visitors can learn about the cultivation and processing of various spices, including cinnamon, cardamom, and pepper."
Matale,Aluvihara Rock Cave Temple,Indoor,An ancient Buddhist temple featuring rock caves with historical paintings and inscriptions. Provides insights into Sri Lanka's religious heritage.
Matale,Matale Heritage Centre,Indoor,"A cultural center showcasing traditional crafts, artifacts, and the history of the Matale region. Visitors can engage with local artisans and learn about the area's heritage."
Kurunegala,Kurunegala Lake (Ethugala),Outdoor,"A picturesque lake surrounded by lush greenery, ideal for leisurely walks, picnics, and enjoying sunset views. The area is also known for the iconic Elephant Rock, offering panoramic views of the city."
Kurunegala,Samadhi Buddha Statue,Outdoor,"One of the tallest granite Buddha statues in the world, situated atop a hill. Visitors can enjoy a serene environment and panoramic views of Kurunegala."
Kurunegala,Ridi Viharaya (Silver Temple),Outdoor,An ancient Buddhist temple known for its intricate carvings and historical significance. The temple is built into a rock face and offers insights into Sri Lanka's rich cultural heritage.
Kurunegala,Kurunegala Rock (Athugala),Outdoor,"A prominent rock formation resembling an elephant, offering hiking opportunities and panoramic views of the city. The summit features a large Buddha statue and is a popular spot for both locals and tourists."
Kurunegala,Kurunegala Provincial Museum,Indoor,"Showcases artifacts and exhibits related to the region's history, culture, and archaeology. A great place to learn about the local heritage, especially during rainy days."
Kurunegala,Shopping at Local Markets,Indoor,"Explore indoor markets offering local handicrafts, textiles, and spices. An excellent opportunity to purchase souvenirs and experience the local commerce scene."
Ambalangoda,Ambalangoda Beach,Outdoor,"A serene beach known for its golden sands and clear waters, ideal for sunbathing, swimming, and leisurely walks. The tranquil environment makes it a perfect spot for relaxation."
Ambalangoda,Madu River Safari,Outdoor,"The Madu River is renowned for its mangrove forests and biodiversity. Boat safaris offer visitors the chance to explore the river's ecosystem, spot various bird species, and visit small islands with temples and cinnamon plantations."
