Area,Place to Visit,Activity Type,Description
Arugam Bay,Kumana National Park Safari,Outdoor,"Embark on a wildlife safari to spot elephants, leopards, and a variety of bird species in their natural habitat. The park is approximately 44 km from Arugam Bay."
Arugam Bay,Surfing,Outdoor,"Arugam Bay is celebrated as one of the world's top surfing destinations, offering waves suitable for all skill levels. The main surf season spans from May to September."
Arugam Bay,Lagoon Tours,Outdoor,"Explore the serene Pottuvil Lagoon by boat, observing mangroves, birdlife, and possibly crocodiles."
Arugam Bay,Crocodile Rock,Outdoor,"A short trek leads to this rock formation, offering panoramic views and opportunities to spot wildlife, including crocodiles."
Arugam Bay,Elephant Rock,Outdoor,"A favored spot for both surfing and enjoying sunsets, providing scenic views and a tranquil environment."
Arugam Bay,Beach Hopping,Outdoor,Visit nearby beaches like Peanut Farm Beach and Whiskey Point for relaxation and surfing.
Arugam Bay,Yoga Classes,Indoor,"Many local establishments offer yoga sessions, providing relaxation and wellness experiences."
Arugam Bay,Ayurvedic Spa,Indoor,"Indulge in traditional Ayurvedic therapies at local spas, such as the Ama Ayurvedic Spa and Medical Centre, known for its holistic treatments. "
Arugam Bay,Cooking Classes,Indoor,Participate in Sri Lankan cooking classes to learn about local cuisine and culinary techniques.
Arugam Bay,Muhudu Maha Viharaya,Outdoor,"An ancient Buddhist temple situated near the beach, offering insights into the region's history and architecture."
Arugam Bay,Kudumbigala Monastery,Outdoor,"Explore this historic monastery complex, featuring meditation caves and ancient inscriptions."
Arugam Bay,Lahugala Kitulana National Park,Outdoor,"Approximately 16 km inland, this park is known for its elephant population and diverse flora and fauna."
Arugam Bay,Panama Village,Outdoor,"A traditional village about 12 km south of Arugam Bay, offering cultural experiences and access to natural attractions like the Panama Tank."
Arugam Bay,Okanda,Outdoor," Located around 32 km south, Okanda is known for its temple and as a gateway to the Kumana National Park."
Nuwara Eliya,Gregory Lake,Outdoor,"A central attraction in Nuwara Eliya, Gregory Lake offers boating, paddle boating, and jet skiing. The surrounding park is ideal for picnics and leisurely walks."
Nuwara Eliya,Horton Plains National Park,Outdoor,"A UNESCO World Heritage site, this park features cloud forests, highland grasslands, and the famous World's End cliff. It's a haven for hikers and nature enthusiasts."
Nuwara Eliya,Tea Plantation Tours,Outdoor,Explore lush tea estates like Pedro Tea Estate and Bluefield Tea Gardens to learn about tea cultivation and enjoy scenic views.
Nuwara Eliya,Moon Plains,Outdoor,"Offering panoramic views of the surrounding mountains and valleys, Moon Plains is a popular spot for nature walks and wildlife sightings."
Nuwara Eliya,Lover's Leap Waterfall,Outdoor,"A short hike through tea plantations leads to this beautiful waterfall, offering serene views and a refreshing atmosphere."
Nuwara Eliya,Victoria Park,Outdoor,"Located in the heart of Nuwara Eliya, this well-maintained park is perfect for leisurely strolls, bird watching, and enjoying the blooming flowers."
Nuwara Eliya,Nuwara Eliya Post Office,Indoor,"Visit this iconic Tudor-style building, one of the oldest post offices in Sri Lanka, to admire its architecture and send postcards."
Nuwara Eliya,Tea Factory Visits,Indoor,Tour factories like the Bluefield Tea Factory to observe the tea-making process and sample freshly brewed Ceylon tea.
Nuwara Eliya,Seetha Amman Temple,Indoor,"A Hindu temple with intricate carvings, believed to be the site where Sita was held captive in the Ramayana epic."
Nuwara Eliya,Hakgala Botanical Gardens,Outdoor,"Established in the 19th century, these gardens showcase a diverse range of flora, including orchids and roses, set against a backdrop of misty hills."
Nuwara Eliya,St. Clair's Falls and Devon Falls,Outdoor,"Often referred to as the ""Little Niagara of Sri Lanka,"" these waterfalls are located near Nuwara Eliya and are popular for their scenic beauty."
Nuwara Eliya,Ambewela Farm,Outdoor,"Known as ""Little New Zealand,"" this dairy farm offers guided tours where visitors can learn about cattle farming and taste fresh dairy products."
Kandy,Kandy Lake (Bogambara Lake),Outdoor,"Located in the heart of the city, Kandy Lake offers a serene environment for leisurely walks along its perimeter, with views of the surrounding hills and the Temple of the Tooth."
Kandy,Kandy Esala Perahera (Festival of the Tooth),Outdoor,"A grand annual Buddhist festival held in July or August, featuring elaborate processions with traditional dancers, drummers, fire performers, and beautifully decorated elephants. The highlight of the festival is the sacred relic of Lord Buddha's tooth, which is paraded through the streets of Kandy.  Best time to visit is the festival season, typically over ten nights leading to the full moon of Esala (July or August)."
Kandy,"Royal Botanical Gardens, Peradeniya",Outdoor,"Spanning 147 acres, these gardens boast over 4,000 plant species, including orchids, palms, and medicinal plants. It's an ideal spot for picnics and nature walks. "
Kandy,Udawatta Kele Sanctuary,Outdoor,"A forest reserve located north of Kandy Lake, offering trails for hiking and bird-watching amidst lush greenery."
Kandy,Bahirawakanda Vihara Buddha Statue,Outdoor,This towering statue provides panoramic views of Kandy. Visitors can climb to the top for a closer look and enjoy the surrounding scenery.
Kandy,Commonwealth War Cemetery,Outdoor,"A well-maintained cemetery honoring soldiers from World War II, offering a tranquil environment for reflection."
Kandy,Embekke Devalaya,Outdoor,"Located 13 km from Kandy, this temple is renowned for its intricate wood carvings and pillars, showcasing traditional Sinhalese craftsmanship."
Kandy,Gadaladeniya Temple,Outdoor,"Situated 12 km from Kandy, this 14th-century Buddhist temple features South Indian architectural influences and stone carvings."
Kandy,Knuckles Mountain Range,Outdoor,"Ideal for trekking and nature excursions, this range is about 40 km northeast of Kandy and offers diverse flora, fauna, and scenic landscapes."
Kandy,Pinnawala Elephant Orphanage,Outdoor,"Approximately 40 km northwest of Kandy, this sanctuary cares for orphaned elephants. Visitors can observe feeding and bathing routines."
Kandy,Temple of the Sacred Tooth Relic (Sri Dalada Maligawa),Indoor,"A UNESCO World Heritage site, this temple houses a sacred tooth of the Buddha and is a significant pilgrimage site. Visitors can explore the temple complex and witness traditional rituals."
Kandy,Kandy National Museum,Indoor,"Adjacent to the Temple of the Tooth, the museum showcases artifacts from the Kandyan era, including weapons, jewelry, and historical documents."
Kandy,Ceylon Tea Museum,Indoor,"Located in Hantane, this museum provides insights into Sri Lanka's tea industry, displaying vintage tea-processing equipment and offering tea tastings."
Kandy,Kandy Cultural Centre,Indoor,Experience traditional Kandyan dance performances and cultural shows that highlight Sri Lanka's rich artistic heritage.
Kandy,Shopping at Kandy City Centre,Indoor,"A modern shopping complex where visitors can purchase local crafts, souvenirs, and enjoy a variety of dining options"
Kandy,Queens Hotel,Indoor,"A historical hotel located in the heart of Kandy, adjacent to the Temple of the Tooth and Kandy Lake. It is known for its colonial architecture, luxurious ambiance, and as a prime spot for dining and relaxing in a heritage setting. Visitors can also explore its lobby and enjoy its rich historical significance as part of Kandy's colonial past."
Kataragama,Kataragama Temple Complex,Outdoor,"A sacred site comprising multiple shrines, including the Kataragama Devalaya dedicated to Lord Skanda (Murugan) and the Kiri Vehera Stupa, a significant Buddhist site. Visitors can observe daily rituals and participate in religious ceremonies."
Kataragama,Kataragama Festival,Outdoor,"An annual event held in July or August, featuring vibrant processions, traditional dances, and fire-walking ceremonies. It's a profound cultural experience attracting devotees and tourists alike."
Kataragama,Yala National Park Safari,Outdoor,"Located approximately 22 km from Kataragama, Yala National Park is renowned for its diverse wildlife, including elephants, leopards, and a variety of bird species. Guided jeep safaris offer an adventurous outdoor experience."
Kataragama,Kebiliththa Pilgrimage,Outdoor," A remote and sacred site deep within the jungle, believed to be a meditation spot of Lord Kataragama. The journey requires a challenging off-road trek, appealing to adventure enthusiasts."
Kataragama,Menik Ganga (River),Outdoor,A holy river where pilgrims perform purification rituals. Visitors can enjoy the serene environment and observe traditional bathing practices.
Kataragama,Sithulpawwa Rock Temple,Outdoor,"Approximately 19 km from Kataragama, this ancient Buddhist monastery is situated atop a rock, offering panoramic views and insights into historical architecture."
Kataragama,Bundala National Park,Outdoor,"Around 36 km from Kataragama, this park is a UNESCO Biosphere Reserve, ideal for bird watching and experiencing diverse ecosystems."
Kataragama,Indoor Board Games at Kele Resort,Indoor,"Kele Resort provides indoor board games such as carrom, chess, checkers, and cards, offering a relaxing environment for guests."
Kataragama,Traditional Cooking Demonstrations,Indoor,"Some local establishments may offer traditional cooking demonstrations, allowing visitors to learn about Sri Lankan culinary practices."
Kataragama,Ayurvedic Wellness Centers,Indoor,"While not specific to Kataragama, nearby towns may have Ayurvedic centers offering traditional treatments and massages."
Anuradhapura,Jaya Sri Maha Bodhi,Outdoor,"This sacred fig tree is believed to be a sapling from the original Bodhi tree under which Buddha attained enlightenment. Planted in 288 BC, it is considered the oldest living human-planted tree in the world. Pilgrims and visitors come to pay their respects and meditate in its serene surroundings."
Anuradhapura,Ruwanwelisaya Stupa,Outdoor,"Built by King Dutugemunu in the 2nd century BC, this magnificent stupa is a marvel of ancient engineering and a central place of worship for Buddhists. Its massive white dome and tranquil ambiance make it a must-visit site."
Anuradhapura,Jetavanaramaya Monastery,Outdoor,"Once the world's tallest stupa, Jetavanaramaya stands at 122 meters and is part of a vast monastic complex. Visitors can explore the ruins and appreciate the grandeur of ancient Sri Lankan architecture."
Anuradhapura,Thuparamaya,Outdoor,"Constructed by King Devanampiya Tissa in the 3rd century BC, Thuparamaya is the oldest dagoba in Sri Lanka and enshrines the collarbone relic of the Buddha. It holds immense historical and religious significance."
Anuradhapura,Lovamahapaya,Outdoor,"Once a nine-story monastic complex with a bronze roof, Lovamahapaya was an architectural wonder of its time. Today, only the stone pillars remain, reflecting its past grandeur."
Anuradhapura,Abhayagiri Dagaba,Outdoor,"Part of the extensive Abhayagiri Monastery complex, this dagoba was a major center of Theravada and Mahayana Buddhism. The site offers insights into monastic life and ancient architecture. "
Anuradhapura,Mirisaveti Stupa,Outdoor,"Built by King Dutugemunu after his victory over King Elara, this stupa holds historical significance and is a testament to the architectural prowess of ancient Sri Lanka."
Anuradhapura,Lankarama Stupa,Outdoor,"Constructed by King Valagamba, Lankarama is a unique stupa with an elegant design. The site is tranquil, offering a peaceful environment for reflection."
Anuradhapura,Isurumuniya Temple,Outdoor,"Known for its exquisite rock carvings, including the famous 'Isurumuniya Lovers,' this temple showcases the artistic heritage of Anuradhapura. The temple's serene environment makes it a popular spot for meditation and reflection."
Anuradhapura,Kalu Diya Pokuna,Outdoor,"Meaning 'Black Water Pond,' this ancient bathing pool is located in Mihintale, near Anuradhapura. Surrounded by lush greenery and rock formations, it offers a tranquil setting and insights into the hydraulic engineering of ancient Sri Lanka."
Anuradhapura,Samadhi Buddha Statue,Outdoor,"This iconic statue depicts the Buddha in a state of deep meditation (Samadhi). Carved from granite, it is considered a masterpiece of ancient sculpture and a symbol of spiritual serenity."
Anuradhapura,Kuttam Pokuna (Twin Ponds),Outdoor,"These twin bathing tanks are masterpieces of ancient hydrological engineering, reflecting the advanced skills of the Anuradhapura civilization. The site is peaceful and offers a glimpse into the daily life of monks."
Anuradhapura,Mihintale,Outdoor,"Located about 12 km east of Anuradhapura, Mihintale is the birthplace of Buddhism in Sri Lanka. The site features a series of religious monuments and offers panoramic views after a climb of 1,840 steps. "
Anuradhapura,Wilpattu National Park,Outdoor,"Approximately 30 km west of Anuradhapura, this park is renowned for its leopard population and diverse wildlife. Jeep safaris provide an opportunity to experience Sri Lanka's natural beauty."
Anuradhapura,Anuradhapura Archaeological Museum,Indoor,"This museum houses artifacts from the Anuradhapura period, including statues, coins, and tools, providing visitors with a deeper understanding of the ancient city's history and culture."
Polonnaruwa,Polonnaruwa Ancient City,Outdoor,"explore the well-preserved ruins of the ancient capital, including the Royal Palace, Audience Hall, and other significant structures. It offers a deep dive into Sri Lankan history and culture."
Polonnaruwa,Parakrama Samudra,Outdoor,"A vast reservoir built by King Parakramabahu I, showcasing ancient hydraulic engineering."
Polonnaruwa,Minneriya National Park Safari,Outdoor,"Famous for ""The Gathering,"" where hundreds of elephants come together during the dry season."
Polonnaruwa,Somawathiya Temple,Outdoor,"A sacred Buddhist site believed to house a relic of Lord Buddha's tooth. Located within the Somawathiya National Park, the temple is surrounded by lush greenery and wildlife, offering a tranquil environment for meditation and religious observances."
Polonnaruwa,Gal Vihara,Outdoor,"Known for its large rock-cut Buddha statues, representing the artistic excellence of the Polonnaruwa era."
Polonnaruwa,Parakramabahu Statue,Outdoor,"An impressive 11-foot-2-inch stone sculpture believed to represent King Parakramabahu I, showcasing the artistry of the Polonnaruwa era."
Polonnaruwa,Kaudulla Tank,Outdoor,"An ancient reservoir now part of Kaudulla National Park, attracting diverse wildlife, especially elephants."
Polonnaruwa,Polonnaruwa Archaeological Museum,Indoor,Exhibits artifacts and provides insights into the history and culture of the ancient city.
Sigiriya,Sigiriya Rock,Outdoor,"A UNESCO World Heritage Site, this ancient rock fortress features the ruins of a palace atop a 200-meter-high rock, surrounded by extensive gardens, moats, and frescoes."
Sigiriya,Pidurangala Rock,Outdoor,"Adjacent to Sigiriya, Pidurangala offers a less crowded climb with a stunning view of Sigiriya Rock and the surrounding landscape."
Sigiriya,Minneriya National Park,Outdoor,"Known for ""The Gathering,"" where large herds of elephants congregate, especially during the dry season."
Sigiriya,Hiriwadunna Village,Outdoor,"Experience traditional Sri Lankan village life, including bullock cart rides, boat trips on the lake, and authentic local meals. "
Sigiriya,Elephant Rides and Safaris,Outdoor,"Several operators offer elephant-back rides and safaris in the Sigiriya area, providing a unique perspective of the landscape."
Sigiriya,Sigiriya Museum,Indoor,"Offers insights into the history, art, and architecture of the Sigiriya Rock Fortress, with artifacts and exhibits detailing its past."
Sigiriya,Ayurvedic Spa Treatments,Indoor,Several resorts and wellness centers in Sigiriya offer traditional Ayurvedic treatments aimed at relaxation and rejuvenation.
Sigiriya,Cooking Classes,Indoor,Participate in Sri Lankan cooking classes to learn about local cuisine and culinary techniques.
Trincomalee,Koneswaram Temple,Outdoor,"An ancient Hindu temple perched atop Swami Rock within Fort Frederick, overlooking the Indian Ocean. This sacred site is dedicated to Lord Shiva and is often referred to as the ""Temple of a Thousand Pillars."" Its serene ambiance and breathtaking views make it a must-visit."
Trincomalee,Pigeon Island National Park,Outdoor,"A marine sanctuary featuring coral reefs and diverse marine life, including reef sharks, sea turtles, and vibrant fish species. Located a short boat ride from Nilaveli Beach, this island is a haven for snorkelers and divers."
Trincomalee,Nilaveli Beach,Outdoor,"A pristine stretch of golden sand and clear blue waters, Nilaveli Beach is ideal for relaxation and enjoying water sports. Its calm atmosphere makes it perfect for families and couples."
Trincomalee,Fort Frederick,Outdoor," A historic fort constructed by the Portuguese in 1624 and later occupied by the Dutch and British. Today, it houses military barracks and is home to the iconic Koneswaram Temple."
Trincomalee,Whale and Dolphin Watching,Outdoor,"Trincomalee is one of the best locations in the world for spotting blue whales, sperm whales, and dolphins. Tours typically operate during the migration season from March to August."
Trincomalee,Kanniya Hot Springs,Outdoor,"A site of seven natural hot water wells, historically linked to Hindu mythology. Each well has a slightly different temperature, and visitors can bathe in the therapeutic waters."
Trincomalee,Seruwila Mangala Raja Maha Vihara,Outdoor,"A Buddhist temple believed to enshrine a relic of Lord Buddha, attracting pilgrims and visitors alike. "
Trincomalee,Kanniya Hot Springs,Outdoor,"A site of seven natural hot water wells, each with varying temperatures, historically linked to Hindu mythology. Visitors can bathe in the therapeutic waters."
Trincomalee,Marble Beach,Outdoor,"Situated approximately 16 km south of Trincomalee, Marble Beach is celebrated for its clear turquoise waters and powdery white sands. The beach is managed by the Sri Lankan Air Force and offers a tranquil setting for visitors."
Trincomalee,Maritime and Naval History Museum,Indoor,"Housed in a restored colonial building, this museum chronicles Sri Lanka's maritime history and naval heritage, showcasing artifacts, models, and interactive exhibits."
Trincomalee,Pathirakali Amman Temple,Indoor,"A vibrant Hindu temple dedicated to Goddess Kali, showcasing intricate Dravidian architecture and colorful sculptures. It's a spiritual and artistic experience."
Trincomalee,Trincomalee War Cemetery,Indoor,"One of the six Commonwealth War Cemeteries in Sri Lanka, this tranquil site commemorates soldiers who lost their lives during World War II. "
Jaffna,Nallur Kandaswamy Kovil,Outdoor,"A prominent Hindu temple renowned for its Dravidian architecture and vibrant annual festivals. The temple's history dates back to the 15th century, making it a significant spiritual center in Jaffna."
Jaffna,Jaffna Fort,Outdoor,"Constructed by the Portuguese in 1618 and later expanded by the Dutch, this fort offers insights into colonial military architecture and provides panoramic views of the Jaffna Lagoon."
Jaffna,Casuarina Beach,Outdoor,"Known for its calm, shallow waters and lined with Casuarina trees, this beach is ideal for relaxation and swimming. It's considered one of the best beaches in the Jaffna Peninsula."
Jaffna,Delft Island (Neduntheevu),Outdoor,"Accessible by ferry, this island boasts wild ponies, coral walls, and the ruins of a Dutch fort, reflecting a unique blend of natural and historical attractions."
Jaffna,Keerimalai Natural Springs,Outdoor,"Freshwater springs believed to have therapeutic properties, located near the sea and associated with local legends."
Jaffna,Nagadeepa Purana Vihara,Outdoor,"This ancient Buddhist temple, located on Nagadeepa Island, is one of the 16 sacred sites in Sri Lanka. It is believed to be the site where Lord Buddha mediated a dispute between two Naga kings. Accessible by ferry, the temple is a serene spiritual retreat."
Jaffna,Kankesanthurai Beach (KKS),Outdoor,"A scenic beach in the northernmost part of the Jaffna Peninsula, known for its clear waters and historical significance as a key port during ancient times."
Jaffna,Jaffna Public Library,Indoor,A restored cultural landmark that houses a vast collection of Tamil literature and manuscripts. The library symbolizes Jaffnas resilience and cultural richness.
Jaffna,Jaffna Archaeological Museum,Indoor,"A treasure trove of artifacts, including statues, coins, and tools, reflecting Jaffna's rich cultural history."
Jaffna,Cargills Square,Indoor,"A modern shopping and entertainment complex featuring retail outlets, a food court, and a multiplex cinema."
Kalpitiya,Kite Surfing,Outdoor,"Kalpitiya is a premier destination for kite surfing, offering consistent winds and ideal lagoon conditions, especially from April to October."
Kalpitiya,Dolphin and Whale Watching,Outdoor,"The coastal waters of Kalpitiya are home to large populations of spinner dolphins, with sightings almost guaranteed. During the whale watching season, visitors may also spot blue whales, sperm whales, and other marine giants."
Kalpitiya,Snorkeling and Diving at Bar Reef,Outdoor,"Bar Reef is the largest coral reef in Sri Lanka, boasting vibrant marine life and clear waters."
Kalpitiya,Kalpitiya Lagoon,Outdoor,A stunning lagoon that is a paradise for nature lovers and adventure seekers alike.
Kalpitiya,Wilpattu National Park Safari,Outdoor,"Located a couple of hours from Kalpitiya, Wilpattu is Sri Lanka's largest national park, famous for its leopard population and diverse wildlife."
Kalpitiya,The BNKR,Indoor,"A destination for adventurous fitness, sport, and health enthusiasts, offering a fun, sustainable strength and conditioning gym, CrossFit box, and healthy café year-round."
Kalpitiya,Cultural Tours,Indoor,"While Kalpitiya is primarily known for its natural attractions, guided tours can provide insights into local fishing communities and their traditional lifestyles."
Passikudah,Passikudah Beach,Outdoor,"A crescent-shaped bay with calm, shallow waters extending several meters into the sea, making it ideal for swimming and water sports. "
Passikudah,Kalkudah Beach,Outdoor,"A tranquil beach adjacent to Passikudah, known for its white sands and clear waters, offering a peaceful retreat from the more frequented spots."
Passikudah,Water Sports and Diving,Outdoor,Passikudah's calm waters are perfect for various water sports.
Passikudah,Batticaloa Dutch Fort,Outdoor,"A historic fort built in the 17th century by the Portuguese and later occupied by the Dutch and British, reflecting colonial architecture."
Passikudah,Spa and Wellness Centers,Indoor,Several resorts in Passikudah offer spa treatments focusing on relaxation and rejuvenation.
Passikudah,Cooking Classes,Indoor,Some local establishments offer classes where visitors can learn to prepare traditional Sri Lankan dishes.
Passikudah,Cultural Performances,Indoor,"Occasionally, resorts and local venues host traditional music and dance performances, showcasing Sri Lankan heritage."
Bentota,Bentota Beach,Outdoor,"Renowned for its pristine sands and clear waters, Bentota Beach is ideal for sunbathing, swimming, and water sports such as jet skiing and windsurfing."
Bentota,Madu Ganga River Safari,Outdoor,"Explore the rich biodiversity of the Madu River through a boat safari, navigating mangrove forests and observing local wildlife."
Bentota,Kosgoda Sea Turtle Conservation Project,Outdoor,Learn about turtle conservation efforts and witness the process of releasing hatchlings into the sea.
Bentota,Brief Garden by Bevis Bawa,Indoor,"Explore the exquisite landscape architecture blending art and nature, with beautifully designed gardens and sculptures."
Bentota,Lunuganga Estate,Indoor,"Visit the former residence of Geoffrey Bawa, showcasing unique architectural designs amidst lush gardens."
Bentota,Dedduwa Lake,Outdoor,"Known for its serene waters and surrounding marshlands, it's an excellent spot for boating and enjoying the natural scenery."
Haputale,Lipton’s Seat,Outdoor,A vantage point offering panoramic views of the surrounding tea plantations and hills. It was a favored spot of Sir Thomas Lipton. Early morning visits provide the clearest views.
Haputale,Diyaluma Falls,Outdoor,"Standing at 220 meters, it's Sri Lanka's second-highest waterfall. The falls are accessible via a scenic drive from Haputale, and the area is ideal for picnics and nature walks."
Haputale,Stassen Organic Tea Farm,Outdoor,"Located approximately 5 km from Haputale, this tea farm offers insights into organic tea cultivation. Visitors can engage in tea tasting and purchase fresh tea products."
Haputale,Hiking the Devil’s Staircase,Outdoor,"A challenging trek that rewards hikers with stunning landscapes, including tea estates and mountain vistas. It's advisable to undertake this hike with a guide."
Haputale,Bambarakanda Falls,Outdoor,"At 263 meters, it's the tallest waterfall in Sri Lanka. The surrounding area offers hiking trails and picnic spots, making it a perfect day-trip destination."
Haputale,Adisham Bungalow,Indoor,"A Benedictine monastery set in a Tudor-style mansion, reflecting colonial architecture. Visitors can explore its well-maintained gardens and purchase homemade jams and cordials."
Haputale,St. Andrew's Church,Indoor,A historic Anglican church showcasing colonial-era architecture. It's a serene place for reflection and offers insights into the area's colonial past.
