Area,Place to Visit,Activity Type,Description
Matara,Polhena Beach,Outdoor,"A serene beach ideal for swimming and snorkeling, protected by a coral reef that ensures calm waters. It's also a popular spot for observing sea turtles in their natural habitat."
Matara,Matara Beach,Outdoor,"A picturesque stretch of golden sand and clear waters, perfect for relaxation and enjoying the coastal scenery. The beach is easily accessible and offers opportunities for leisurely walks along the shore."
Matara,Dondra Head Lighthouse,Outdoor,"Standing at the southernmost point of Sri Lanka, this historic lighthouse offers panoramic views of the Indian Ocean. Visitors can explore the surrounding area and enjoy the scenic beauty of the coastline."
Matara,Snake Farm Thelijjawila,Outdoor,An educational facility where visitors can learn about various snake species native to Sri Lanka. The farm provides insights into snake conservation and safety.
Matara,Surfing at Medawatta Beach,Outdoor,"A popular spot for surfing enthusiasts, offering suitable waves for both beginners and experienced surfers. Surf schools are available for those looking to learn."
Matara,Star Fort,Indoor,"Built by the Dutch in the shape of a star, this fort is a testament to colonial architecture and history. Visitors can explore its unique design and learn about its historical significance."
Matara,Weherahena Temple,Indoor,A significant Buddhist temple known for its large Buddha statue and intricate murals depicting Jataka tales. The temple offers a peaceful environment for reflection and exploration.
Matara,Old Dutch Trade Center (Nupe Market),Indoor,"A historic building that once served as a trade center during the Dutch colonial period. Today, it stands as a reminder of Matara's rich history and architectural heritage."
Puttalam,Puttalam Lagoon,Outdoor,"A vast lagoon ideal for birdwatching, boating, and observing local fishing activities. The surrounding mangroves and wetlands attract diverse bird species, making it a haven for nature enthusiasts."
Puttalam,Alankuda Beach,Outdoor,"A serene beach known for dolphin and whale watching, as well as water sports like kite surfing and snorkeling. The calm waters and pristine sands make it a perfect spot for relaxation and adventure."
Puttalam,Kalpitiya Peninsula,Outdoor,"Renowned for its marine biodiversity, it's a prime location for dolphin and whale watching, as well as kite surfing. The peninsula's natural beauty and vibrant marine life offer unforgettable experiences."
Puttalam,Anawilundawa Wetland Sanctuary,Outdoor,"A Ramsar wetland site that provides a habitat for numerous bird species, making it a paradise for birdwatchers and nature lovers. The sanctuary's diverse ecosystems support a wide range of flora and fauna."
Puttalam,Mundal Lagoon,Outdoor,"A brackish lagoon surrounded by mangroves and salt marshes, ideal for birdwatching and experiencing local fishing culture. The lagoon's serene environment offers a peaceful retreat for visitors."
Puttalam,"St. Anne’s Church, Talawila",Indoor,"One of the oldest and most revered Christian pilgrimage sites in Sri Lanka, attracting visitors of all faiths. The church's serene atmosphere and historical significance make it a must-visit."
Puttalam,Munneswaram Temple,Indoor,"A historic Hindu temple complex known for its intricate architecture and annual festivals, reflecting the rich cultural heritage of the region. The temple's spiritual ambiance offers a unique cultural experience."
Puttalam,Paramakanda Raja Maha Vihara,Indoor,"An ancient Buddhist temple situated on a rock, offering panoramic views and insights into the region's religious history. The temple's serene environment provides a tranquil escape for visitors."
Weligama,Weligama Beach,Outdoor,"A picturesque sandy beach ideal for swimming, sunbathing, and observing local fishermen. The beach's gentle waves make it a popular spot for beginner surfers."
Weligama,Surfing Lessons,Outdoor,"Weligama is renowned for its surf-friendly waters, making it an excellent place for beginners to learn surfing. Numerous surf schools along the beach offer lessons and board rentals."
Weligama,Kushtarajagala Statue,Outdoor,"An ancient rock-carved statue believed to date back to the 9th century, reflecting Mahayanist Buddhist influence. It's easily accessible and offers insight into the region's historical significance."
Weligama,Whale Watching Tours,Outdoor,"Nearby Mirissa, just a short drive away, is famous for whale watching excursions, offering the chance to see blue whales, sperm whales, and dolphins in their natural habitat."
Weligama,Stilt Fishermen Observation,Outdoor,"Along the coast near Weligama, you can observe traditional stilt fishermen practicing their unique fishing method, especially during early morning or late afternoon."
Weligama,Spa and Wellness Centers,Indoor,"Weligama offers several spas and wellness centers where visitors can indulge in traditional Ayurvedic treatments and massages, providing relaxation and rejuvenation."
Weligama,Cooking Classes,Indoor,"Participate in local cooking classes to learn how to prepare traditional Sri Lankan dishes, offering a cultural immersion and a delightful culinary experience."
Weligama,Handicraft Workshops,Indoor,"Engage in workshops that teach traditional Sri Lankan arts and crafts, such as mask painting or pottery, allowing you to create and take home a unique souvenir."
Badulla,Dunhinda Falls,Outdoor,"A stunning 64-meter waterfall renowned for its misty spray, creating a 'smoky' appearance. A 1.5 km trek through lush terrain leads to the viewing platform, making it a favorite among nature lovers and hikers."
Badulla,Namunukula Mountain Range,Outdoor,"Comprising nine peaks, with the highest reaching approximately 2,036 meters, this range offers hiking trails through tea plantations and forests, rewarding trekkers with panoramic views of the Badulla district."
Badulla,Bogoda Ancient Wooden Bridge,Outdoor,"Believed to be over 400 years old, this wooden bridge, constructed without nails, is set amidst a tranquil environment, offering insights into ancient engineering and a serene spot for relaxation."
Badulla,Demodara Nine Arch Bridge,Outdoor,"An iconic viaduct built during the British colonial era, featuring nine arches amidst dense jungle and tea plantations. It's a popular spot for photography, especially when trains pass over the bridge."
Badulla,Muthiyangana Temple,Outdoor,"One of the Solosmasthana, the 16 sacred sites visited by Buddha, this ancient temple is located in the heart of Badulla and is a significant pilgrimage site, reflecting the region's rich Buddhist heritage."
Badulla,St. Mark’s Church,Indoor,"An Anglican church built during the British colonial period, showcasing Gothic architecture. The serene atmosphere and historical significance make it a peaceful retreat for visitors interested in colonial history."
Badulla,Dhowa Rock Temple,Indoor,"A protected heritage site featuring an unfinished Buddha statue carved into the rock face and ancient murals, offering insights into the region's artistic and religious history."
Badulla,Old Welekade Market,Indoor,"A historic colonial-era market building where visitors can explore local handicrafts, textiles, and produce, providing a glimpse into Badulla's commercial heritage."
Hambantota,Ridiyagama Safari Park,Outdoor,"Experience wildlife up close in this expansive park, home to various animals including elephants, lions, and zebras. Guided safaris provide educational insights into animal behavior and conservation efforts."
Hambantota,Mirijjawila Botanical Garden,Outdoor,"Explore a vast collection of dry zone flora in this serene garden, ideal for leisurely walks and picnics. The garden showcases the region's unique plant species and offers a tranquil escape from the bustling city."
Hambantota,Walawe River Safari,Outdoor,"Embark on a boat safari along the Walawe River to observe diverse bird species, crocodiles, and other wildlife in their natural habitat. The lush landscapes surrounding the river provide a picturesque backdrop for photography enthusiasts."
Hambantota,Kumana National Park,Outdoor,"A haven for birdwatchers, this park is renowned for its avian diversity, including migratory species. Guided tours offer opportunities to spot elephants, leopards, and a variety of birdlife amidst the park's wetlands and forests."
Hambantota,Agro Technology Park,Outdoor,Learn about sustainable farming practices and Sri Lanka's agricultural heritage in this interactive park. Visitors can engage with various exhibits showcasing modern and traditional farming techniques.
Hambantota,Birds Research Center & Resort,Indoor,"An indoor sanctuary dedicated to the study and conservation of various bird species. Visitors can observe and learn about the center's avian inhabitants, making it an educational experience for all ages."
Hambantota,Dry Zone Botanic Gardens - Hambantota,Indoor,Explore the diverse plant species adapted to Sri Lanka's dry climate in this indoor facility. The gardens offer educational exhibits on plant conservation and the importance of preserving native flora.
Diyatalawa,Hiking Trails in Diyatalawa,Outdoor,"The region boasts several trails suitable for hiking enthusiasts, offering panoramic views of the surrounding landscapes. The cool climate and lush greenery make it an ideal location for outdoor adventures."
Diyatalawa,Ivery Cold Water Spring,Outdoor,"A natural spring known for its exceptionally cold water, providing a refreshing experience for visitors. It's a popular spot for both locals and tourists seeking a natural retreat."
Diyatalawa,Adisham Bungalow in Haputale,Indoor,"A Benedictine monastery set in a Tudor-style mansion, reflecting colonial architecture. Visitors can explore its well-maintained gardens and purchase homemade jams and cordials."
Diyatalawa,Dhowa Rock Temple near Bandarawela,Indoor,"A protected heritage site featuring an unfinished Buddha statue carved into the rock face and ancient murals, offering insights into the region's artistic and religious history."
Negombo,Negombo Beach,Outdoor,"A picturesque stretch of golden sands and clear waters, ideal for sunbathing, swimming, and water sports such as kite surfing and windsurfing. The beach is also renowned for its stunning sunsets."
Negombo,Negombo Fish Market (Lellama),Outdoor,"Experience the bustling atmosphere of one of Sri Lanka's largest fish markets, where fishermen display their daily catch. It's an excellent opportunity to observe local trade and sample fresh seafood."
Negombo,Muthurajawela Marsh,Outdoor,"Explore the rich biodiversity of this wetland ecosystem through a boat tour, offering sightings of various bird species, reptiles, and mangroves. It's a haven for nature enthusiasts."
Negombo,Hamilton Canal,Outdoor,"Built during the Dutch colonial period, this canal runs through Negombo and is ideal for boat rides, providing a unique perspective of the city's landscape and daily life."
Negombo,Dutch Fort,Outdoor,"Although only a part of the fort remains, it stands as a testament to Negombo's colonial history. Adjacent to the fort is the old Dutch cemetery, reflecting the city's historical significance."
Negombo,St. Mary's Church,Indoor,"A prominent Catholic church known for its impressive architecture and vibrant ceiling paintings, reflecting Negombo's rich Christian heritage. It's one of the largest cathedrals in Sri Lanka."
Negombo,Angurukaramulla Temple (Bodhirajaramaya),Indoor,"This Buddhist temple features a giant Buddha statue and intricate murals. Visitors can explore the temple's historical library and the dragon entrance, which adds to its unique charm."
Negombo,Ave Maria Convent,Indoor,"An educational institution with a chapel that showcases beautiful stained-glass windows and serene surroundings, offering a peaceful retreat for visitors interested in architecture and history."
Negombo,Negombo Dutch Museum,Indoor,"Housed in a restored Dutch-era building, the museum exhibits artifacts from the colonial period, providing insights into Negombo's historical and cultural past."
Ella,Little Adam's Peak,Outdoor,"A relatively easy hike leading to panoramic views of the surrounding hills and tea plantations. The trail is well-marked, making it suitable for hikers of various skill levels. Early morning or late afternoon hikes are recommended to avoid midday heat."
Ella,Nine Arch Bridge,Outdoor,"An iconic railway bridge nestled amidst lush greenery, showcasing impressive colonial-era engineering. It's a popular spot for photography, especially when trains pass over the bridge."
Ella,Ella Rock,Outdoor,"A more challenging hike compared to Little Adam's Peak, offering rewarding vistas of the Ella Gap and surrounding landscapes. The trek can take 3-4 hours round trip, so starting early is advisable."
Ella,Ravana Falls,Outdoor,"A popular waterfall located just outside Ella, ideal for a refreshing dip. The falls are especially vibrant during the rainy season."
Ella,Kithal Ella Waterfall,Outdoor,"A lesser-known waterfall located near Kithal Ella railway station. It's quieter and more secluded than Ravana Falls, offering a peaceful spot to relax amidst nature."
Ella,Demodara Loop and Railway Station,Outdoor,"Famous for its unique spiral railway loop, where the track crosses itself via a tunnel under the station. It's a marvel of engineering and a favorite among train enthusiasts and photographers."
Ella,Flying Ravana Mega Zipline,Outdoor,"For adrenaline enthusiasts, this zipline offers a thrilling ride over the lush landscapes of Ella, providing a unique vantage point of the area's natural beauty."
Ella,Nil Diya Pokuna,Outdoor,"A mysterious underground pond located in a cave. It is a hidden gem in Ella, offering adventurous exploration for visitors who enjoy spelunking and unique experiences."
Ella,Secret Falls,Outdoor,"A hidden waterfall near Ella, accessible through a short trek. It's a secluded and serene spot, perfect for nature lovers seeking a quiet escape."
Ella,Cooking Classes,Indoor,"Engage in Sri Lankan culinary traditions by participating in local cooking classes. Learn to prepare traditional dishes using fresh, local ingredients, offering a hands-on cultural experience."
Ella,Tea Factory Tours,Indoor,Explore the process of tea production by visiting nearby tea factories. Gain insights into the journey from leaf to cup and enjoy tastings of various tea blends.
Ella,Ella Spice Garden,Indoor,Visit this small but informative garden to learn about the spices grown in Sri Lanka. The guided tours often include explanations of their culinary and medicinal uses.
Hikkaduwa,Hikkaduwa Beach,Outdoor,"Renowned for its golden sands and clear waters, this beach is ideal for sunbathing, swimming, and surfing. The area is lined with numerous restaurants and bars, making it a lively spot for both day and night activities."
Hikkaduwa,Turtle Beach,Outdoor,"A popular spot for turtle-spotting, snorkeling, diving, and surfing. This location is perfect for closely witnessing marine life."
Hikkaduwa,Hikkaduwa Coral Sanctuary,Outdoor,"A shallow fringing reef with a high degree of biodiversity, making it a popular spot for snorkeling and glass-bottom boat tours. Visitors can observe vibrant corals and a variety of marine species up close."
Hikkaduwa,Surfing,Outdoor,"Hikkaduwa is a renowned surfing destination, offering waves suitable for both beginners and experienced surfers. Several surf schools and rental shops are available along the beach."
Hikkaduwa,Diving and Snorkeling,Outdoor,"The clear waters of Hikkaduwa are perfect for diving and snorkeling, with opportunities to explore coral reefs, shipwrecks, and diverse marine life. Numerous dive centers offer equipment and guided tours."
Hikkaduwa,River Safari on the Madu Ganga,Outdoor,"Experience the rich biodiversity of mangrove forests, observe local wildlife, and visit small islands with unique attractions during a boat safari on the Madu River."
Hikkaduwa,Community Tsunami Museum,Indoor,"This museum provides insights into the devastating 2004 tsunami, showcasing photographs, stories, and artifacts. It's a poignant reminder of the region's resilience and recovery."
Hikkaduwa,Saffron Robes Art Gallery and Studio,Indoor,"Explore contemporary Sri Lankan art, including paintings and sculptures, at this local gallery. It's an excellent place to appreciate and purchase unique artworks."
Hikkaduwa,Shopping for Local Crafts,Indoor,"Hikkaduwa offers various shops and boutiques where visitors can purchase local handicrafts, jewelry, and souvenirs, providing a glimpse into Sri Lankan artistry."
Galle,Galle Fort,Outdoor,"A UNESCO World Heritage site showcasing a fusion of European architecture and South Asian traditions. Explore cobblestone streets, the Dutch Reformed Church, and the Galle Lighthouse."
Galle,Unawatuna Beach,Outdoor,"Renowned for its golden sands and clear waters, ideal for swimming, sunbathing, and water sports."
Galle,Japanese Peace Pagoda,Outdoor,A serene Buddhist stupa offering panoramic views of Galle and the Indian Ocean. Ideal for meditation and reflection.
Galle,Lagoon Canoeing in Unawatuna,Outdoor,"Explore the mangroves and waterways of Unawatuna by canoe, offering a tranquil encounter with local flora and fauna."
Galle,Cycling Tours,Outdoor,"Guided tours through paddy fields, local villages, and scenic coastal roads to experience Sri Lankan rural life."
Galle,National Maritime Museum,Indoor,"Exhibits artifacts from shipwrecks, models of boats, and other maritime relics, offering insights into naval history."
Galle,Historical Mansion Museum,Indoor,"A private museum showcasing antiques like jewelry, cameras, typewriters, and traditional crafts like beeralu lace embroidery."
Galle,Dutch Reformed Church,Indoor,"An 18th-century church featuring a unique pulpit and an organ dating back centuries, with gravestones marking its floor."
Galle,Cooking Classes,Indoor,Learn to prepare local dishes using traditional methods in local homes or specialized cooking schools.
Galle,Hikkaduwa Beach,Outdoor,"Famous for its coral reefs, snorkeling, and diving, with vibrant nightlife and dining options."
Galle,Koggala Lake,Outdoor,"Dotted with small islands and surrounded by mangrove swamps, boat safaris offer birdwatching and cinnamon island visits."
Galle,Yatagala Raja Maha Viharaya,Outdoor,"A 2,000-year-old Buddhist temple amidst lush greenery and rock formations, ideal for history and spirituality enthusiasts."
Bandarawela,Upper Diyaluma Waterfall,Outdoor,"Sri Lanka's second-highest waterfall. A moderate hike leads to the top, where natural pools offer a refreshing dip. Surrounding vistas are breathtaking."
Bandarawela,Trekking in Tea Plantations,Outdoor,Guided treks through lush tea estates offer insights into tea cultivation and panoramic views of the hills.
Bandarawela,Pilkington Point,Outdoor,"Offers sweeping views of mountains and valleys, ideal for picnics and sunrise vistas."
Bandarawela,Porawagala,Outdoor,"Scenic area with grasslands, woodlands, waterfalls, and mountains. A tranquil spot for nature walks and relaxation."
Bandarawela,Dhowa Rock Temple,Indoor,An ancient Buddhist temple featuring a 12-foot unfinished Buddha statue carved into rock and ancient murals.
Bandarawela,Adisham Bungalow,Indoor,"A historic mansion showcasing colonial architecture, now a monastery and museum surrounded by gardens."
Bandarawela,St. Anthony's Church,Indoor,Colonial-era church known for its architecture and peaceful ambiance. A tranquil spot for reflection.
Bandarawela,Ella Rock,Outdoor,"A trek offering panoramic views of the countryside, through tea plantations and forests."
Bandarawela,Nine Arches Bridge,Outdoor,A colonial-era architectural marvel set amidst jungle and tea plantations. A favorite spot for photography.
Bandarawela,Lipton’s Seat,Outdoor,"Offers expansive views of surrounding tea estates and countryside, a favorite of Sir Thomas Lipton."
Ratnapura,Katugas Ella Waterfall,Outdoor,"A picturesque waterfall ideal for nature walks and picnics, surrounded by lush greenery."
Ratnapura,Kalthota Doowili Ella Falls,Outdoor,"A 40-meter waterfall located in the Rajawaka Reserve, accessible via a forest trek."
Ratnapura,Sinharaja Forest Reserve,Outdoor,A UNESCO World Heritage tropical rainforest known for its rich biodiversity and guided tours.
Ratnapura,Adam's Peak (Sri Pada),Outdoor,A sacred mountain attracting pilgrims and hikers with panoramic sunrise views.
Ratnapura,National Museum Ratnapura,Indoor,"Showcases exhibits on natural history, including geological specimens and gem industry artifacts."
Ratnapura,Dhanaja Gem Museum,Indoor,A gemological museum offering insights into the gem industry with a vast collection of precious stones.
Ratnapura,Kajugaswatta Temple,Indoor,"Located on a hill with panoramic views, known for ancient paintings and relics."
Ratnapura,Udawalawe National Park,Outdoor,Renowned for its elephant population; offers safari tours to observe wildlife in their natural habitat.
Knuckles,Hiking and Trekking,Outdoor,"Trails through dense forests, grasslands, and waterfalls, suitable for various skill levels. Popular routes include Loolwatte and Corbet’s Gap."
Knuckles,Bird Watching and Wildlife Observation,Outdoor,"Spot over 120 bird species, mammals, and reptiles. Ideal for wildlife enthusiasts with early mornings being optimal for sightings."
Knuckles,Camping,Outdoor,Designated camping sites allow immersion in nature. Necessary permits required.
Knuckles,Exploring Pitawala Pathana,Outdoor,A unique grassland featuring the 'Mini World's End' with panoramic views. A 0.75 km nature trail leads to the viewpoint.
Knuckles,Riverston,Outdoor,Known for its misty conditions and stunning views from the peak. A short hike leads to panoramic vistas.
Knuckles,Temple of the Sacred Tooth Relic (Kandy),Indoor,"Located about 50 km away, this cultural site houses a sacred tooth relic of Buddha."
Knuckles,Sembuwatta Lake,Outdoor,"A serene man-made lake surrounded by tea plantations, offering activities like boating and swimming."
Knuckles,Hunas Falls,Outdoor,"A picturesque waterfall ideal for nature walks and picnics, surrounded by lush greenery."
Kitulgala,White Water Rafting,Outdoor,"Thrilling rafting experience on the Kelani River, suitable for beginners and seasoned rafters with guided tours available."
Kitulgala,Canyoning and Waterfall Abseiling,Outdoor,Adventure-filled activities involving waterfall descents and natural rock slides under professional guidance.
Kitulgala,Jungle Trekking,Outdoor,"Guided treks through dense rainforests leading to hidden waterfalls and caves, offering an immersive nature experience."
Kitulgala,Bird Watching,Outdoor,Makandawa Forest Reserve offers sightings of endemic and migratory bird species. Early mornings are optimal.
Kitulgala,Mountain Biking,Outdoor,"Scenic trails through rubber and tea plantations, perfect for cycling enthusiasts seeking adventure."
Kitulgala,Belilena Cave Exploration,Outdoor,"Historic cave known for archaeological significance, featuring prehistoric human habitation. Accessible via a trek."
Kitulgala,Tea Plantation Visits,Indoor,"Guided tours in nearby tea estates offering insights into tea cultivation and processing, with tea-tasting sessions."
Kitulgala,Local Cooking Classes,Indoor,Participate in cooking classes to learn Sri Lankan culinary traditions and prepare local dishes using traditional methods.
Kitulgala,Aberdeen Falls,Outdoor,"A 98-meter picturesque waterfall, perfect for picnics and nature lovers."
Kitulgala,Laxapana Falls,Outdoor,A 126-meter impressive waterfall offering stunning views and photography opportunities.
Tangalle,Goyambokka Beach,Outdoor,"A picturesque beach with golden sands and clear waters, ideal for swimming and sunbathing. Beachfront restaurants and sun loungers available."
Tangalle,Silent Beach,Outdoor,"A tranquil, semi-private beach perfect for relaxation and leisurely walks. Less crowded and serene."
Tangalle,Hummanaya Blow Hole,Outdoor,"Seawater jets through a submerged cavern, creating impressive water spouts. Best viewed during high tide."
Tangalle,Rekawa Turtle Conservation Project,Outdoor,Observe sea turtles nesting at night with guidance from conservationists. Best during April to July.
Tangalle,Kalametiya Bird Sanctuary,Outdoor,"A sanctuary for bird watchers, offering guided boat tours through mangroves and lagoons to observe diverse bird species."
Tangalle,Mulkirigala Raja Maha Vihara,Outdoor,"Ancient Buddhist temple complex with cave paintings and statues, offering panoramic views."
Tangalle,Spa and Wellness Centers,Indoor,Relax with Ayurvedic treatments and massages using natural herbs and oils.
Tangalle,Cooking Classes,Indoor,Learn to prepare traditional Sri Lankan dishes using local methods in homes or cooking schools.
Tangalle,Art Galleries and Craft Shops,Indoor,Explore local art galleries featuring traditional and contemporary Sri Lankan art and craftsmanship.
Maskeliya,Adam's Peak (Sri Pada),Outdoor,"A sacred mountain revered by multiple religions, offering a challenging hike to witness stunning sunrise views."
Maskeliya,Hiking the Seven Virgins Mountain Range,Outdoor,"Challenging treks through dense forests and rugged terrain, with panoramic vistas of surrounding landscapes."
Maskeliya,Gartmore Falls,Outdoor,"Also known as Sri Pada Falls, surrounded by lush greenery, making it a serene spot for nature enthusiasts."
Maskeliya,Lanka Ella,Outdoor,"A tranquil and lesser-known waterfall, ideal for relaxation and photography."
Maskeliya,Maskeliya Reservoir,Outdoor,"A picturesque reservoir perfect for boat rides, picnics, and bird watching."
Maskeliya,Tea Plantation Tours,Outdoor,"Explore lush tea estates, learn about tea cultivation, and enjoy fresh tea tasting."
Maskeliya,Educational Visits to Tea Factories,Indoor,"Gain insights into tea manufacturing through guided tours, including demonstrations and tea purchases."
